select	source	code	creator	date	title	identifier	publisher
1	http://obvil.github.io/critique2000/tei/clerget_1906.xml	1906_clerget_louis-xavier-ricard-fernand-clerget_GALLICA	Clerget, Fernand (1865-1931)	1906	Louis-Xavier de Ricard / Fernand Clerget	http://gallica.bnf.fr/ark:/12148/bpt6k54253144	“Revue littéraire de Paris et de Champagne” (Reims)
1	http://obvil.github.io/critique2000/tei/clerget_1912.xml	1912_clerget_villiers-isle-adam-portraits-documents-fernand-clerget_GALLICA	Clerget, Fernand (1865-1931)	1912	Villiers de l'Isle-Adam : 32 portraits et documents / Fernand Clerget	http://gallica.bnf.fr/ark:/12148/bpt6k113925m	L. Michaud (Paris)
1	http://obvil.github.io/critique2000/tei/clouard_1891.xml	1891_clouard_oeuvre-champfleury-dressee-propres-notes-completee_GALLICA	Clouard, Maurice (1857-19..)	1891	L'Oeuvre de Champfleury / dressée, d'après ses propres notes, et complétée par M. Maurice Clouard	http://gallica.bnf.fr/ark:/12148/bpt6k1147996	L. Sapin (Paris)
1	http://obvil-dev.paris-sorbonne.fr/corpus/critique/revue-wagnerienne_tome-1.xml	1886_collectif_revue-wagnerienne-tome_OBVIL	Collectif	1886	Revue wagnérienne (tome I)	http://obvil.paris-sorbonne.fr/corpus/critique/revue-wagnerienne_tome-1.xml/	
1	http://obvil-dev.paris-sorbonne.fr/corpus/critique/revue-wagnerienne_tome-2.xml	1887_collectif_b_revue-wagnerienne-tome_OBVIL	Collectif	1887	Revue wagnérienne (tome II)	http://obvil.paris-sorbonne.fr/corpus/critique/revue-wagnerienne_tome-3.xml/	
1	http://obvil-dev.paris-sorbonne.fr/corpus/critique/revue-wagnerienne_tome-3.xml	1888_collectif_b_revue-wagnerienne-tome_OBVIL	Collectif	1888	Revue wagnérienne (tome III)	http://obvil.paris-sorbonne.fr/corpus/critique/revue-wagnerienne_tome-3.xml/	
1	http://obvil-dev.paris-sorbonne.fr/corpus/critique/marges_latin.xml	1911_collectif_enquete-question-latin_OBVIL	Collectif	1911	Enquête sur la question du latin	http://obvil.paris-sorbonne.fr/corpus/critique/marges_latin/	
1	http://obvil-dev.paris-sorbonne.fr/corpus/critique/marges_theatre-et-livre.xml	1912_collectif_enquete-theatre-livre_OBVIL	Collectif	1912	Enquête sur le théâtre et le livre	http://obvil.paris-sorbonne.fr/corpus/critique/marges_theatre-et-livre/	
1	http://obvil-dev.paris-sorbonne.fr/corpus/critique/marges_academie.xml	1914_collectif_enquete-academie-francaise_OBVIL	Collectif	1914	Enquête : L’Académie française	http://obvil.paris-sorbonne.fr/corpus/critique/marges_academie/	
1	http://obvil-dev.paris-sorbonne.fr/corpus/critique/marges_prix-litteraires.xml	1914_collectif_b_enquete-prix-litteraires_OBVIL	Collectif	1914	Enquête : Les prix littéraires	http://obvil.paris-sorbonne.fr/corpus/critique/marges_prix-litteraires/	
1	http://obvil-dev.paris-sorbonne.fr/corpus/critique/revue-action_n2.xml	1920_collectif_action-n2-mars_OBVIL	Collectif	1920	Action – n°2 (mars 1920)	http://obvil.paris-sorbonne.fr/corpus/critique/revue-action_n2/	
1	http://obvil-dev.paris-sorbonne.fr/corpus/critique/revue-action_n3.xml	1920_collectif_b_action-n3-avril-extraits_OBVIL	Collectif	1920	Action – n°3 (avril 1920), Extraits	http://obvil.paris-sorbonne.fr/corpus/critique/revue-action_n3/	
1	http://obvil-dev.paris-sorbonne.fr/corpus/critique/revue-action_n4.xml	1920_collectif_c_action-n4-juillet-extraits_OBVIL	Collectif	1920	Action – n°4 (juillet 1920), Extraits	http://obvil.paris-sorbonne.fr/corpus/critique/revue-action_n4/	
1	http://obvil-dev.paris-sorbonne.fr/corpus/critique/marges_poetes-midi.xml	1920_collectif_d_enquete-poetes-langue-francaise-midi_OBVIL	Collectif	1920	Enquête : Pourquoi aucun des grands poètes de langue française n’est-il du Midi ?	http://obvil.paris-sorbonne.fr/corpus/critique/marges_poetes-midi/	
1	http://obvil-dev.paris-sorbonne.fr/corpus/critique/marges_critique.xml	1921_collectif_enquete-critique_OBVIL	Collectif	1921	Enquête sur la critique	http://obvil.paris-sorbonne.fr/corpus/critique/marges_critique/	
1	http://obvil-dev.paris-sorbonne.fr/corpus/critique/marges_19e-siecle.xml	1922_collectif_enquete-siecle-siecle_OBVIL	Collectif	1922	Enquête : Le XIXe siècle est-il un grand siècle ?	http://obvil.paris-sorbonne.fr/corpus/critique/marges_19e-siecle/	
1	http://obvil.github.io/critique2000/tei/collectif_1887.xml	1887_collectif_bulletin-comite-travaux-historiques-scientifiques-section_GALLICA	Comité des travaux historiques et scientifiques (France)	1887	Bulletin du Comité des travaux historiques et scientifiques. Section d'histoire et de philologie	http://gallica.bnf.fr/ark:/12148/bpt6k57413783	Comité des travaux historiques et scientifiques (Paris)
1	http://obvil.github.io/critique2000/tei/commynes_1896.xml	1896_commynes_chroniqueurs-francais-moyen-age-villehardouin-joinville_GALLICA	Commynes, Philippe de (1447-1511)	1896	Les chroniqueurs français du moyen âge, Villehardouin, Joinville, Froissart, Commines : nouveaux extraits... / précédés d'une introduction sur les origines de l'histoire de France et sur les... travaux de la philologie moderne, avec des notices biographiques, des appréciations littéraires et un commentaire grammatical des textes par M. Charles Aubertin,...	http://gallica.bnf.fr/ark:/12148/bpt6k6272545j	Belin frères (Paris)
1	http://obvil.github.io/critique2000/tei/saint-maur_1865_4.xml	1865_saint-maur_4_histoire-litteraire-france-traite-origine-progres-decadence_GALLICA	Congrégation de Saint-Maur	1865	Histoire littéraire de la France : où l'on traite de l'origine et du progrès, de la décadence et du rétablissement des sciences parmi les Gaulois et parmi les François.... Tome 4 / par des religieux bénédictins de la Congrégation de S. Maur	http://gallica.bnf.fr/ark:/12148/bpt6k28028p	V. Palmé (Paris)
1	http://obvil.github.io/critique2000/tei/saint-maur_1865_9.xml	1865_saint-maur_9_histoire-litteraire-france-traite-origine-progres-decadence_GALLICA	Congrégation de Saint-Maur	1865	Histoire littéraire de la France : où l'on traite de l'origine et du progrès, de la décadence et du rétablissement des sciences parmi les Gaulois et parmi les François.... Tome 9 / par des religieux bénédictins de la Congrégation de S. Maur	http://gallica.bnf.fr/ark:/12148/bpt6k280338	V. Palmé (Paris)
1	http://obvil.github.io/critique2000/tei/constant_1829.xml	1829_constant_melanges-litterature-politique-benjamin-constant_GALLICA	Constant, Benjamin (1767-1830)	1829	Mélanges de littérature et de politique , par M. Benjamin Constant	http://gallica.bnf.fr/ark:/12148/bpt6k1113078	Pichon et Didier (Paris)
1	http://obvil.github.io/critique2000/tei/coquelin_1881.xml	1881_coquelin_poete-foyer-eugene-manuel-c-coquelin_GALLICA	Coquelin, Constant (1841-1909)	1881	Un poète du foyer, Eugène Manuel, par C. Coquelin,...	http://gallica.bnf.fr/ark:/12148/bpt6k5445623p	P. Ollendorff (Paris)
1	http://obvil.github.io/critique2000/tei/coquelin_1882.xml	1882_coquelin_poete-philosophe-sully-prudhomme-c-coquelin_GALLICA	Coquelin, Constant (1841-1909)	1882	Un poète philosophe : Sully-Prudhomme / par C. Coquelin,...	http://gallica.bnf.fr/ark:/12148/bpt6k5401799t	P. Ollendorff (Paris)
1	http://obvil.github.io/critique2000/tei/coquiot_1912.xml	1912_coquiot_vrai-k-huysmans-gustave-coquiot-portrait-f-raffaelli_GALLICA	Coquiot, Gustave (1865-1926)	1912	Le vrai J.- K. Huysmans,... / Gustave Coquiot ; avec un portrait... par J.-F. Raffaëlli. lettre-préface de 1896 à G. Coquiot / J.-K- Huysmans	http://gallica.bnf.fr/ark:/12148/bpt6k4058660	C. Bosse (Paris)
1	http://obvil.github.io/critique2000/tei/corneille_1872.xml	1872_corneille_theatre-classique-contenant-cid-horace-cinna-polyeucte_GALLICA	Corneille, Pierre (1606-1684)	1872	Théâtre classique : contenant le Cid, Horace, Cinna, Polyeucte, de P. Corneille, Britannicus, Esther, Athalie, de Racine, Le misanthrope, de Molière, et les principales scènes de Mérope, de Voltaire (Nouvelle édition contenant des notes historiques, grammaticales et littéraires, l'analyse des pièces toutes les préfaces des auteurs, et des appréciations littéraires et analytiques empruntées aux meilleurs critiques) / par MM. Aderer, Aulard, Gidel, Henry et Jonette,...	http://gallica.bnf.fr/ark:/12148/bpt6k5544049s	E. Belin (Paris)
1	http://obvil.github.io/critique2000/tei/corneille_1786.xml	1786_corneille_chefs-d-oeuvre-t-corneille_GALLICA	Corneille, Thomas (1625-1709)	1786	Chefs-d'oeuvre de T. Corneille. [1]	http://gallica.bnf.fr/ark:/12148/bpt6k5610036b	Petite bibliothèque des théâtres (Paris)
1	http://obvil.github.io/critique2000/tei/coudert_1904.xml	1904_coudert_avarie-sujet-roman-insexuee-paul-bru-conference-faite_GALLICA	Coudert, Émile (Dr)	1904	L'autre avarie, au sujet du roman “l'Insexuée”, de Paul Bru : conférence faite au théâtre de l'Athénée Saint-Germain, le 5 mai 1904 / par le Dr Émile Coudert,...	http://gallica.bnf.fr/ark:/12148/bpt6k54080592	J. Rousset (Paris)
1	http://obvil.github.io/critique2000/tei/cournand_1803.xml	1803_cournand_epitre-avantages-poesie-cournand_GALLICA	Cournand, Antoine de (1747-1814)	1803	Épître sur les avantages de la poésie , par A. Cournand,...	http://gallica.bnf.fr/ark:/12148/bpt6k6209559t	impr. de Brasseur aîné (Paris)
1	http://obvil-dev.paris-sorbonne.fr/corpus/critique/cousin_introduction-philosophie.xml	1828_cousin_introduction-histoire-philosophie_OBVIL	Cousin, Victor (1792-1867)	1828	Introduction à l’histoire de la philosophie	http://obvil.paris-sorbonne.fr/corpus/critique/cousin_introduction-histoire-philosophie/	
1	http://obvil-dev.paris-sorbonne.fr/corpus/critique/cousin_kant.xml	1840_cousin_kant-philosophie_OBVIL	Cousin, Victor (1792-1867)	1840	Kant et sa philosophie	http://obvil.paris-sorbonne.fr/corpus/critique/cousin_kant	
1	http://obvil-dev.paris-sorbonne.fr/corpus/critique/cousin_du-vrai.xml	1858_cousin_vrai-beau-ed_OBVIL	Cousin, Victor (1792-1867)	1858	Du vrai, du beau et du bien (7e éd.)	http://obvil.paris-sorbonne.fr/corpus/critique/cousin_du-vrai	
1	http://obvil.github.io/critique2000/tei/cousin_1865.xml	1865_cousin_madame-sable-nouvelles-etudes-femmes-illustres-societe_GALLICA	Cousin, Victor (1792-1867)	1865	Madame de Sablé : Nouvelles études sur les femmes illustres de la société du XVIIe siècle (3e édition...) / par M. Victor Cousin	http://gallica.bnf.fr/ark:/12148/bpt6k6438319m	Didier (Paris)
1	http://obvil.github.io/critique2000/tei/coutance_1882.xml	1882_coutance_fontaine-philosophie-naturelle-coutance_GALLICA	Coutance, Amédée-Guillaume-Auguste (1824-1895)	1882	La Fontaine et la philosophie naturelle / par A. Coutance,...	http://gallica.bnf.fr/ark:/12148/bpt6k1077356	C. Reinwald (Paris)
1	http://obvil.github.io/critique2000/tei/crebillon_1789.xml	1789_crebillon_chefs-d-oeuvre-crebillon_GALLICA	Crébillon, Prosper Jolyot de (1674-1762)	1789	Chefs-d'oeuvre de Crébillon	http://gallica.bnf.fr/ark:/12148/bpt6k57271490	Belin (Paris)
1	http://obvil-dev.paris-sorbonne.fr/corpus/critique/crevel_esprit-contre-raison.xml	1926_crevel_esprit-raison_OBVIL	Crevel, René (1900-1935)	1926	L’Esprit contre la raison	http://obvil.paris-sorbonne.fr/corpus/critique/crevel_esprit-contre-raison/	
1	http://obvil-dev.paris-sorbonne.fr/corpus/critique/crevel_clavecin-diderot.xml	1932_crevel_clavecin-diderot_OBVIL	Crevel, René (1900-1935)	1932	Le Clavecin de Diderot	http://obvil.paris-sorbonne.fr/corpus/critique/crevel_clavecin-diderot/	
1	http://obvil.github.io/critique2000/tei/croiset_1896_1.xml	1896_croiset_1_histoire-litterature-grecque-tome-alfred-croiset-maurice_GALLICA	Croiset, Alfred (1845-1923)	1896	Histoire de la littérature grecque. Tome 1 / par Alfred Croiset, Maurice Croiset,...	http://gallica.bnf.fr/ark:/12148/bpt6k66485z	A. Fontemoing (Paris)
1	http://obvil.github.io/critique2000/tei/croiset_1896_3.xml	1896_croiset_3_histoire-litterature-grecque-tome-alfred-croiset-maurice_GALLICA	Croiset, Alfred (1845-1923)	1896	Histoire de la littérature grecque. Tome 3 / par Alfred Croiset, Maurice Croiset,...	http://gallica.bnf.fr/ark:/12148/bpt6k66487n	A. Fontemoing (Paris)
1	http://obvil.github.io/critique2000/tei/crousle_1867.xml	1867_crousle_jeanne-arc-poesie-dramatique-conference-decembre-crousle_GALLICA	Crouslé, Léon (1830-1903)	1867	Jeanne d'Arc dans la poésie dramatique : conférence du 24 décembre 1866 / par M. Crousle,...	http://gallica.bnf.fr/ark:/12148/bpt6k6352479p	impr. de V. Goupy (Paris)
1	http://obvil.github.io/critique2000/tei/crousle_1894.xml	1894_crousle_pessimisme-poesie-crousle_GALLICA	Crouslé, Léon (1830-1903)	1894	Du pessimisme dans la poésie / par M. Crouslé,...	http://gallica.bnf.fr/ark:/12148/bpt6k54674858	A. Faivre et H. Teilhard (Paris)
1	http://obvil.github.io/critique2000/tei/cubieres-palmezeaux_1783.xml	1783_cubieres-palmezeaux_eloge-voltaire-suivi-poesies-diverses_GALLICA	Cubières-Palmézeaux, Michel de (1752-1820)	1783	Éloge de Voltaire , suivi de Poésies diverses	http://gallica.bnf.fr/ark:/12148/bpt6k5445617z	A La Haie ; et se trouve à Paris, chez Gueffier, imprimeur-libraire, rue de la Harpe ; Couturier, imprimeur-libraire, quai des Augustins. M. DCC.L XXXIII
1	http://obvil.github.io/critique2000/tei/cubieres-palmezeaux_1787.xml	1787_cubieres-palmezeaux_lettre-mis-ximenes-influence-boileau-litterature-signe_GALLICA	Cubières-Palmézeaux, Michel de (1752-1820)	1787	Lettre à M. le Mis de Ximenès, sur l'influence de Boileau en littérature / (Signé : le chevalier de [M. de Cubières-Palmézeaux])	http://gallica.bnf.fr/ark:/12148/bpt6k73125r	Royez (Amsterdam)
1	http://obvil.github.io/critique2000/tei/cubieres-palmezeaux_1799.xml	1799_cubieres-palmezeaux_defenseur-philosophie-reponse-satires-dirigees-fin_GALLICA	Cubières-Palmézeaux, Michel de (1752-1820)	1799	Le défenseur de la philosophie, ou Réponse à quelques satires dirigées contre la fin du XVIIIe siècle : satire / par un ami des arts, des lettres et des moeurs (M. de Cubières-Palmézeaux)	http://gallica.bnf.fr/ark:/12148/bpt6k731263	impr. de Moller (Paris)
1	http://obvil.github.io/critique2000/tei/cubieres-palmezeaux_1802.xml	1802_cubieres-palmezeaux_boileau-juge-amis-ennemis-boileau-c-palmezeaux-cubieres-palmezeaux_GALLICA	Cubières-Palmézeaux, Michel de (1752-1820)	1802	Boileau jugé par ses amis et par ses ennemis, ou le Pour et le contre sur Boileau,... par C. Palmézeaux (M. de Cubières-Palmézeaux)	http://gallica.bnf.fr/ark:/12148/bpt6k9615753n	P. Mongie (Paris)
1	http://obvil.github.io/critique2000/tei/curnier_1858.xml	1858_curnier_rivarol-vie-oeuvres-leonce-curnier_GALLICA	Curnier, Léonce (1813-1894)	1858	Rivarol, sa vie et ses oeuvres / par M. Léonce Curnier,...	http://gallica.bnf.fr/ark:/12148/bpt6k57217303	impr. de Ballivet (Nîmes)
1	http://obvil.github.io/critique2000/tei/cuvillier-fleury_1835.xml	1835_cuvillier-fleury_critique-litteraire-c-fl-cuvillier-fleury_GALLICA	Cuvillier-Fleury, Alfred-Auguste (1802-1887)	1835	Critique littéraire / par C. Fl. [Cuvillier-Fleury]	http://gallica.bnf.fr/ark:/12148/bpt6k9609485j	impr. de A. Everat (Paris)
1	http://obvil.github.io/critique2000/tei/cuvillier-fleury_1854.xml	1854_cuvillier-fleury_voyages-voyageurs-cuvillier-fleury_GALLICA	Cuvillier-Fleury, Alfred-Auguste (1802-1887)	1854	Voyages et voyageurs, 1837-1854 / par Cuvillier-Fleury	http://gallica.bnf.fr/ark:/12148/bpt6k63387153	Michel Lévy frères (Paris)
1	http://obvil.github.io/critique2000/tei/cuvillier-fleury_1855.xml	1855_cuvillier-fleury_nouvelles-etudes-historiques-litteraires-cuvillier-fleury_GALLICA	Cuvillier-Fleury, Alfred-Auguste (1802-1887)	1855	Nouvelles études historiques et littéraires / par Cuvillier-Fleury	http://gallica.bnf.fr/ark:/12148/bpt6k9616731c	Michel Lévy frères (Paris)
1	http://obvil.github.io/critique2000/tei/cuvillier-fleury_1863_1.xml	1863_cuvillier-fleury_1_historiens-poetes-romanciers-tome-cuvillier-fleury_GALLICA	Cuvillier-Fleury, Alfred-Auguste (1802-1887)	1863	Historiens, poètes et romanciers. Tome 1 / par Cuvillier-Fleury...	http://gallica.bnf.fr/ark:/12148/bpt6k9609604s	Michel Lévy frères (Paris)
1	http://obvil.github.io/critique2000/tei/cuvillier-fleury_1863_2.xml	1863_cuvillier-fleury_2_historiens-poetes-romanciers-tome-cuvillier-fleury_GALLICA	Cuvillier-Fleury, Alfred-Auguste (1802-1887)	1863	Historiens, poètes et romanciers. Tome 2 / par Cuvillier-Fleury...	http://gallica.bnf.fr/ark:/12148/bpt6k9609705j	Michel Lévy frères (Paris)
1	http://obvil.github.io/critique2000/tei/collectif_1852.xml	1852_collectif_notice-causes-decadence-theatre-province-moyens-regenerer_GALLICA	D..... (ancien directeur et artiste)	1852	Notice sur les causes de la décadence du théâtre en province et des moyens de le régénérer / par M. D....., ancien directeur et artiste	http://gallica.bnf.fr/ark:/12148/bpt6k58320649	N. Tresse (Paris)
1	http://obvil.github.io/critique2000/tei/daire_1782.xml	1782_daire_histoire-litteraire-ville-amiens-abbe-daire_GALLICA	Daire, Louis-François (1713-1792)	1782	Histoire littéraire de la ville d'Amiens... par l'abbé Daire,...	http://gallica.bnf.fr/ark:/12148/bpt6k6246867k	P. F. Didot (Paris)
1	http://obvil.github.io/critique2000/tei/damas-hinard_1824.xml	1824_damas-hinard_chants-lord-byron-suivi-adresse-roi-damas-hinard_GALLICA	Damas-Hinard, Jean-Joseph-Stanislas-Albert (1805-1891)	1824	Chants sur lord Byron , suivi d'une Adresse au Roi, par M. Damas-Hinard	http://gallica.bnf.fr/ark:/12148/bpt6k5452046z	Delaunay (Paris)
1	http://obvil.github.io/critique2000/tei/damas-hinard_1847.xml	1847_damas-hinard_lecon-college-france-discours-histoire-esprit-theatre_GALLICA	Damas-Hinard, Jean-Joseph-Stanislas-Albert (1805-1891)	1847	Une Leçon au Collège de France, discours sur l'histoire et l'esprit du théâtre espagnol, avec un avant-propos, par M. Damas-Hinard	http://gallica.bnf.fr/ark:/12148/bpt6k6478987m	B. Duprat (Paris)
1	http://obvil.github.io/critique2000/tei/damas-hinard_1861.xml	1861_damas-hinard_fontaine-buffon-damas-hinard_GALLICA	Damas-Hinard, Jean-Joseph-Stanislas-Albert (1805-1891)	1861	La Fontaine et Buffon , par Damas Hinard	http://gallica.bnf.fr/ark:/12148/bpt6k56130724	Perrotin (Paris)
1	http://obvil.github.io/critique2000/tei/damiensdegomicourt_1771.xml	1771_damiensdegomicourt_essai-poesie-lyri-comique-jerome-carre_GALLICA	Damiens de Gomicourt, Augustin-Pierre (1723-1790)	1771	Essai sur la poesie lyri-comique , par Jerome Carre	http://gallica.bnf.fr/ark:/12148/bpt6k122824w	A Amsterdam, et se trouve à Paris, chez Delalain, libraire, rue et à côté de la Comédie française. M. DCC. LXXI
1	http://obvil.github.io/critique2000/tei/dampmartin_1794_1.xml	1794_dampmartin_1_essai-litterature-usage-dames-tome-dampmartin_GALLICA	Dampmartin, Anne-Henri Cabet (1755-1825 ; vicomte de)	1794	Essai de littérature, à l'usage des dames. Tome 1 / . Par A.-H. Dampmartin	http://gallica.bnf.fr/ark:/12148/bpt6k6383750c	G. Heintzen (Amsterdam)
1	http://obvil.github.io/critique2000/tei/dampmartin_1794_2.xml	1794_dampmartin_2_essai-litterature-usage-dames-tome-dampmartin_GALLICA	Dampmartin, Anne-Henri Cabet (1755-1825 ; vicomte de)	1794	Essai de littérature, à l'usage des dames. Tome 2 / . Par A.-H. Dampmartin	http://gallica.bnf.fr/ark:/12148/bpt6k6474399h	G. Heintzen (Amsterdam)
1	http://obvil.github.io/critique2000/tei/dancourt_1759.xml	1759_dancourt_dancourt-arlequin-berlin-rousseau-citoyen-geneve_GALLICA	Dancourt, L.-H. (1725-1801)	1759	L.-H. Dancourt, arlequin de Berlin, à M. J.-J. Rousseau, citoyen de Genève	http://gallica.bnf.fr/ark:/12148/bpt6k5656172h	chez J. H. Schneider (Berlin ; et se trouve à Amsterdam)
1	http://obvil.github.io/critique2000/tei/darmesteter_1896.xml	1896_darmesteter_nouvelles-etudes-anglaises-james-darmesteter-avant-propos_GALLICA	Darmesteter, James (1849-1894)	1896	Nouvelles études anglaises / James Darmesteter ; avant-propos de Mme Mary James Darmesteter	http://gallica.bnf.fr/ark:/12148/bpt6k62709867	C. Lévy (Paris)
1	http://obvil.github.io/critique2000/tei/darragon_1809.xml	1809_darragon_lettre-ostensible-remusa-sic-premier-chambellan-s-empereur_GALLICA	Darragon, François-Louis (175.?-1814)	1809	Lettre ostensible à M. Rémusa (“sic”), premier chambellan de S. M. l'Empereur et administrateur général des grands théâtres, sur le “Suborneur joué”, comédie en 5 actes et en vers, imitée en partie du chef-d'oeuvre comique du grand Sakespear, et représentée en Bretagne. (Signé : F.-L. Darragon. 18 mars 1809.)	http://gallica.bnf.fr/ark:/12148/bpt6k56861337	Favre (Paris)
1	http://obvil.github.io/critique2000/tei/darragon_1811.xml	1811_darragon_tarpa-examen-prealable-tragique-comique-avantageux_GALLICA	Darragon, François-Louis (175.?-1814)	1811	Le Tarpa, ou l'Examen préalable tragique et comique, avantageux à l'art, aux auteurs, au théâtre français, par F.-L. Darragon	http://gallica.bnf.fr/ark:/12148/bpt6k5676004w	Dentu (Paris)
1	http://obvil.github.io/critique2000/tei/daru_1817.xml	1817_daru_observations-critiques-ouvrage-intitule-genie-christianisme_GALLICA	Daru, Pierre (1767-1829)	1817	Observations critiques sur l'ouvrage intitulé : “Le génie du christianisme” ; par M. de Chateaubriand . Pour faire suite au Tableau de la littérature française, par M. J. de Chénier	http://gallica.bnf.fr/ark:/12148/bpt6k6274505n	Maradan (Paris)
1	http://obvil.github.io/critique2000/tei/daudet_1923.xml	1923_daudet_pages-inedites-critique-dramatique-alphonse-daudet_GALLICA	Daudet, Alphonse (1840-1897)	1923	Pages inédites de critique dramatique (1874-1880) / Alphonse Daudet	http://gallica.bnf.fr/ark:/12148/bpt6k57442726	E. Flammarion (Paris)
1	http://obvil-dev.paris-sorbonne.fr/corpus/critique/daudet-leon_stupide19e.xml	1922_daudet_stupide-siecle-expose-insanites-meurtrieres-abattues_OBVIL	Daudet, Léon (1867-1942)	1922	Le stupide XIXe siècle, exposé des insanités meurtrières qui se sont abattues sur la France depuis 130 ans, 1789-1919	http://obvil.paris-sorbonne.fr/corpus/critique/daudet-leon_stupide19e/	
1	http://obvil.github.io/critique2000/tei/daudet_1939.xml	1939_daudet_idees-esthetiques-ed-leon-daudet_GALLICA	Daudet, Léon (1867-1942)	1939	Mes idées esthétiques ([2e éd.]) / Léon Daudet,...	http://gallica.bnf.fr/ark:/12148/bpt6k9619658m	A. Fayard (Paris)
1	http://obvil-dev.paris-sorbonne.fr/corpus/critique/david-sauvageot_realisme-et-naturalisme.xml	1890_david-sauvageot_realisme-naturalisme-litterature-art_OBVIL	David-Sauvageot, A. (1856-1899)	1890	Le réalisme et le naturalisme dans la littérature et dans l’art	http://obvil.paris-sorbonne.fr/corpus/critique/david-sauvageot_realisme	
1	http://obvil.github.io/critique2000/tei/delaveleye_1866.xml	1866_delaveleye_saga-nibelungen-eddas-nord-scandinave-traduction-precedee_GALLICA	De Laveleye, Émile (1822-1892)	1866	La “Saga” des Nibelungen dans les Eddas et dans le Nord scandinave. Traduction précédée d'une étude sur la formation des épopées nationales, par É. de Laveleye	http://gallica.bnf.fr/ark:/12148/bpt6k6102862x	A. Lacroix, Verboeckhoven et Cie (Paris)
1	http://obvil.github.io/critique2000/tei/delaforest_1836_1.xml	1836_delaforest_1_theatre-moderne-cours-litterature-dramatique-delaforest_GALLICA	Delaforest, A	1836	Théâtre moderne. Cours de littérature dramatique, par M. A. Delaforest,... Suite aux Mémoires dramatiques de Bachaumont, au Journal de Collé, aux Correspondances et au Lycée de Grimm et de La Harpe, et au Cours de littérature dramatique de Geoffroy	http://gallica.bnf.fr/ark:/12148/bpt6k96158834	Allardin (Paris)
1	http://obvil.github.io/critique2000/tei/delaforest_1836_2.xml	1836_delaforest_2_theatre-moderne-cours-litterature-dramatique-delaforest_GALLICA	Delaforest, A	1836	Théâtre moderne. Cours de littérature dramatique, par M. A. Delaforest,... Suite aux Mémoires dramatiques de Bachaumont, au Journal de Collé, aux Correspondances et au Lycée de Grimm et de La Harpe, et au Cours de littérature dramatique de Geoffroy	http://gallica.bnf.fr/ark:/12148/bpt6k96129913	Allardin (Paris)
1	http://obvil.github.io/critique2000/tei/delahaye_1923.xml	1923_delahaye_verlaine-ernest-delahaye_GALLICA	Delahaye, Ernest (1853-1930)	1923	Verlaine... / Ernest Delahaye	http://gallica.bnf.fr/ark:/12148/bpt6k5440911z	A. Messein (Paris)
1	http://obvil.github.io/critique2000/tei/delaporte_1891.xml	1891_delaporte_merveilleux-litterature-francaise-regne-louis-these_GALLICA	Delaporte, Victor (1846-1910)	1891	Du merveilleux dans la littérature française sous le règne de Louis XIV : thèse pour le doctorat, présentée à la Faculté des lettres de Paris / par P. V. Delaporte	http://gallica.bnf.fr/ark:/12148/bpt6k96268f	Retaux-Bray (Paris)
1	http://obvil.github.io/critique2000/tei/delecluze_1841.xml	1841_delecluze_francois-rabelais-delecluze_GALLICA	Delécluze, Étienne-Jean (1781-1863)	1841	François Rabelais, 1483-1553 ; par M. Delécluze	http://gallica.bnf.fr/ark:/12148/bpt6k58084973	impr. de H. Fournier (Paris)
1	http://obvil.github.io/critique2000/tei/delecluze_1845.xml	1845_delecluze_roland-chevalerie-e-delecluze_GALLICA	Delécluze, Étienne-Jean (1781-1863)	1845	Roland, ou la Chevalerie, par É.-J. Delécluze...	http://gallica.bnf.fr/ark:/12148/bpt6k1338791	J. Labitte (Paris)
1	http://obvil-dev.paris-sorbonne.fr/corpus/critique/delecluze_louis-david.xml	1855_delecluze_louis-david-ecole-temps-souvenirs_OBVIL	Delécluze, Étienne-Jean (1781-1863)	1855	Louis David, son école et son temps : souvenirs	http://obvil.paris-sorbonne.fr/corpus/critique/delecluze_louis-david/	
1	http://obvil.github.io/critique2000/tei/deligne_1852.xml	1852_deligne_bonne-aubaine-litteraire-jules-deligne-causerie-nouveau_GALLICA	Deligne, Jules (1816-1906)	1852	Encore une bonne aubaine littéraire, par M. Jules Deligne, causerie sur un nouveau recueil de fables récemment imprimé à Lille	http://gallica.bnf.fr/ark:/12148/bpt6k6234701k	impr. de E. Reboux (Lille)
