select	source	code	creator	date	title	identifier	publisher
1	http://obvil.github.io/critique2000/tei/noel_1878_b.xml	1878_noel_b_voltaire-vie-oeuvres-lutte-rousseau_GALLICA	Noël, Eugène (1816-1899)	1878	Voltaire, sa vie et ses oeuvres, sa lutte contre Rousseau	http://gallica.bnf.fr/ark:/12148/bpt6k6457971w	M. Dreyfous (Paris)
1	http://obvil.github.io/critique2000/tei/nolhac_1921.xml	1921_nolhac_ronsard-humanisme-pierre-nolhac_GALLICA	Nolhac, Pierre de (1859-1936)	1921	Ronsard et l'humanisme / par Pierre de Nolhac	http://gallica.bnf.fr/ark:/12148/bpt6k331206	Champion (Paris)
1	http://obvil-dev.paris-sorbonne.fr/corpus/critique/nordau_degenerescence.xml	1894_nordau_degenerescence-fin-siecle-mysticisme-egotisme-realisme_OBVIL	Nordau, Max (1849-1923)	1894	Dégénérescence. Fin de siècle, le mysticisme. L’égotisme, le réalisme, le vingtième siècle.	http://obvil.paris-sorbonne.fr/corpus/nordau/nordau_degenerescence-01/	
1	http://obvil.github.io/critique2000/tei/ozanam_1869_01.xml	1869_ozanam_01_oeuvres-completes-f-ozanam-t-pref-ampere_GALLICA	Ozanam, Frédéric (1813-1853)	1869	Oeuvres complètes de A.-F. Ozanam. T. 1 / avec une préf. par M. Ampère...	http://gallica.bnf.fr/ark:/12148/bpt6k217356	J. Lecoffre (Paris)
1	http://obvil.github.io/critique2000/tei/ozanam_1869_02.xml	1869_ozanam_02_oeuvres-completes-f-ozanam-t-pref-ampere_GALLICA	Ozanam, Frédéric (1813-1853)	1869	Oeuvres complètes de A.-F. Ozanam. T. 2 / avec une préf. par M. Ampère...	http://gallica.bnf.fr/ark:/12148/bpt6k21736j	J. Lecoffre (Paris)
1	http://obvil.github.io/critique2000/tei/ozanam_1869_04.xml	1869_ozanam_04_oeuvres-completes-f-ozanam-t-pref-ampere_GALLICA	Ozanam, Frédéric (1813-1853)	1869	Oeuvres complètes de A.-F. Ozanam. T. 4 / 2 / avec une préf. par M. Ampère...	http://gallica.bnf.fr/ark:/12148/bpt6k217387	J. Lecoffre (Paris)
1	http://obvil.github.io/critique2000/tei/ozanam_1869_05.xml	1869_ozanam_05_oeuvres-completes-f-ozanam-t-pref-ampere_GALLICA	Ozanam, Frédéric (1813-1853)	1869	Oeuvres complètes de A.-F. Ozanam. T. 5 / avec une préf. par M. Ampère...	http://gallica.bnf.fr/ark:/12148/bpt6k21739k	J. Lecoffre (Paris)
1	http://obvil.github.io/critique2000/tei/ozanam_1869_06.xml	1869_ozanam_06_oeuvres-completes-f-ozanam-t-pref-ampere_GALLICA	Ozanam, Frédéric (1813-1853)	1869	Oeuvres complètes de A.-F. Ozanam. T. 6 / avec une préf. par M. Ampère...	http://gallica.bnf.fr/ark:/12148/bpt6k21740s	J. Lecoffre (Paris)
1	http://obvil.github.io/critique2000/tei/ozanam_1869_07.xml	1869_ozanam_07_oeuvres-completes-f-ozanam-t-pref-ampere_GALLICA	Ozanam, Frédéric (1813-1853)	1869	Oeuvres complètes de A.-F. Ozanam. T. 7, 1 / avec une préf. par M. Ampère...	http://gallica.bnf.fr/ark:/12148/bpt6k217414	J. Lecoffre (Paris)
1	http://obvil.github.io/critique2000/tei/ozanam_1869_09.xml	1869_ozanam_09_oeuvres-completes-f-ozanam-t-pref-ampere_GALLICA	Ozanam, Frédéric (1813-1853)	1869	Oeuvres complètes de A.-F. Ozanam. T. 9 / avec une préf. par M. Ampère...	http://gallica.bnf.fr/ark:/12148/bpt6k21743t	J. Lecoffre (Paris)
1	http://obvil.github.io/critique2000/tei/ozanam_1869_10.xml	1869_ozanam_10_oeuvres-completes-f-ozanam-t-pref-ampere_GALLICA	Ozanam, Frédéric (1813-1853)	1869	Oeuvres complètes de A.-F. Ozanam. T. 10 / avec une préf. par M. Ampère...	http://gallica.bnf.fr/ark:/12148/bpt6k217445	J. Lecoffre (Paris)
1	http://obvil.github.io/critique2000/tei/ozanam_1869_11.xml	1869_ozanam_11_oeuvres-completes-f-ozanam-t-pref-ampere_GALLICA	Ozanam, Frédéric (1813-1853)	1869	Oeuvres complètes de A.-F. Ozanam. T. 11 / avec une préf. par M. Ampère...	http://gallica.bnf.fr/ark:/12148/bpt6k21745h	J. Lecoffre (Paris)
1	http://obvil.github.io/critique2000/tei/ozerov_1823.xml	1823_ozerov_chefs-d-oeuvre-theatre-russe-ozerof-fon-vizine-krilof_GALLICA	Ozerov, Vladislav Aleksandrovitch	1823	Chefs-d'oeuvre du théâtre russe . Ozerof, Fon-Vizine, Krilof, Schakofskoi	http://gallica.bnf.fr/ark:/12148/bpt6k5464235r	Ladvocat (Paris)
1	http://obvil.github.io/critique2000/tei/pg_1827.xml	1827_pg_guerre-classiques-romantiques-poeme-heroi-comique-chants_GALLICA	P G	1827	La guerre des classiques et des romantiques , poême héroï-comique en trois chants, par M. P. G.	http://gallica.bnf.fr/ark:/12148/bpt6k6207783j	Delaunay (Paris)
1	http://obvil.github.io/critique2000/tei/pacheu_1897.xml	1897_pacheu_dante-verlaine-etudes-idealistes-mystiques-dante-spenser_GALLICA	Pacheu, Jules (1860-19..)	1897	De Dante à Verlaine (études d'idéalistes et mystiques). Dante, Spenser, Bunyan, Shelley, Verlaine, Huysmans	http://gallica.bnf.fr/ark:/12148/bpt6k96384281	E. Plon, Nourrit et Cie (Paris)
1	http://obvil.github.io/critique2000/tei/pailhes_1900.xml	1900_pailhes_nouveau-joubert-chateaubriand-fontanes-fille-sainte-beuve_GALLICA	Pailhès, Gabriel (1847-1910)	1900	Du nouveau sur J. Joubert : Chateaubriand, Fontanes et sa fille, Sainte-Beuve,... / par G. Pailhès	http://gallica.bnf.fr/ark:/12148/bpt6k405676q	Garnier frères (Paris)
1	http://obvil-dev.paris-sorbonne.fr/corpus/critique/palante_antinomies.xml	1913_palante_antinomies-individu-societe_OBVIL	Palante, Georges (1862-1925)	1913	Les antinomies entre l’individu et la société	http ://obvil.paris-sorbonne.fr/corpus/critique/palante_antinomies	
1	http://obvil-dev.paris-sorbonne.fr/corpus/critique/pardo-bazan_naturalisme.xml	1886_pardobazan_naturalisme_OBVIL	Pardo Bazán, Emilia (1851-1921)	1886	Le Naturalisme	http://obvil.paris-sorbonne.fr/corpus/critique/pardo-bazan_naturalisme/	
1	http://obvil.github.io/critique2000/tei/paris-gaston_1882.xml	1882_paris-gaston_paulin-paris-litterature-francaise-moyen-age-lecon_GALLICA	Paris, Gaston (1839-1903)	1882	Paulin Paris et la littérature française au moyen âge : leçon d'ouverture du cours de langue et littérature française du moyen âge au Collège de France, le... 8 décembre 1881 / par M. Gaston Paris,...	http://gallica.bnf.fr/ark:/12148/bpt6k63246s	impr. de G. Chamerot (Paris)
1	http://obvil-dev.paris-sorbonne.fr/corpus/critique/paris-gaston_legendes.xml	1903_paris_legendes-moyen-age_OBVIL	Paris, Gaston (1839-1903)	1903	Légendes du Moyen Âge	http://obvil.paris-sorbonne.fr/corpus/critique/paris-gaston_legendes/	
1	http://obvil.github.io/critique2000/tei/paris-paulin_1859.xml	1859_paris-paulin_chansons-geste-poemes-siecle-discours-ouverture-cours_GALLICA	Paris, Paulin (1800-1881)	1859	Les chansons de geste, poèmes du XIIe et du XIIIe siècle : discours d'ouverture du cours de langue et de littérature du moyen âge, prononcé le 6 décembre 1858,... / par Paulin Paris,...	http://gallica.bnf.fr/ark:/12148/bpt6k67347c	J. Techener (Paris)
1	http://obvil.github.io/critique2000/tei/parisis_1885.xml	1885_parisis_vie-parisienne-ville-theatre-parisis-emile-blavet_GALLICA	Parisis (1838-1924)	1885	La Vie parisienne : la ville et le théâtre : 1884 [à 1889] / par Parisis (Emile Blavet)	http://gallica.bnf.fr/ark:/12148/bpt6k6429198k	L. Boulanger et P. Ollendorff (Paris)
1	http://obvil.github.io/critique2000/tei/parisis_1886.xml	1886_parisis_vie-parisienne-parisis-emile-blavet-preface-aurelien_GALLICA	Parisis (1838-1924)	1886	La vie parisienne / par Parisis (Emile Blavet) ; [préface par Aurélien Scholl]	http://gallica.bnf.fr/ark:/12148/bpt6k64174000	P. Ollendorff (Paris)
1	http://obvil.github.io/critique2000/tei/parisis_1888.xml	1888_parisis_vie-parisienne-parisis-emile-blavet-preface-henry-fouquier_GALLICA	Parisis (1838-1924)	1888	La vie parisienne : (1887) / par Parisis (Émile Blavet) ; préface d'Henry Fouquier	http://gallica.bnf.fr/ark:/12148/bpt6k6423231w	P. Ollendorff (Paris)
1	http://obvil.github.io/critique2000/tei/pastoret_1869_13.xml	1869_pastoret_13_histoire-litteraire-france-t-suite-siecle-nouvelle_GALLICA	Pastoret, Emmanuel (1755-1840)	1869	Histoire littéraire de la France. T. XIII, Suite du XIIe siècle (Nouvelle édition, conforme à la précédente) / [par Pastoret, Dom Brial, Ginguené et Daunou] ; ouvrage commencé par des religieux Bénédictins de la Congrégation de Saint-Maur ; et continué par une Commission prise dans la classe d'histoire et de littérature ancienne de l'Institut	http://gallica.bnf.fr/ark:/12148/bpt6k6269361v	V. Palmé (Paris)
1	http://obvil.github.io/critique2000/tei/pastoret_1869_14.xml	1869_pastoret_14_histoire-litteraire-france-t-suite-siecle-dom-brial_GALLICA	Pastoret, Emmanuel (1755-1840)	1869	Histoire littéraire de la France. T. XIV, suite du XIIe siècle / [par Dom Brial, Daunou, Ginguené et Pastoret. avec une notice sur M. Ginguené / par Amaury Duval] ; ouvrage commencé par des religieux Bénédictins de la Congrégation de Saint-Maur et continué par des membres de l'Académie royale des inscriptions et belles-lettres	http://gallica.bnf.fr/ark:/12148/bpt6k6276116p	V. Palmé (Paris)
1	http://obvil.github.io/critique2000/tei/pastoret_1869_15.xml	1869_pastoret_15_histoire-litteraire-france-t-suite-siecle-dom-brial_GALLICA	Pastoret, Emmanuel (1755-1840)	1869	Histoire littéraire de la France. T. XV, suite du XIIe siècle / [par Dom Brial, Daunou, Amaury Duval, Ginguené et Pastoret] ; ouvrage commencé par des religieux Bénédictins de la Congrégation de Saint-Maur et continué par des membres de l'Académie royale des inscriptions et belles-lettres	http://gallica.bnf.fr/ark:/12148/bpt6k6358602p	V. Palmé (Paris)
1	http://obvil.github.io/critique2000/tei/patin_1873.xml	1873_patin_etudes-tragiques-grecs-eschyle-patin_GALLICA	Patin, Henri Joseph Guillaume	1873	Etudes sur les tragiques grecs. 3. Eschyle / par M. Patin,...	http://gallica.bnf.fr/ark:/12148/bpt6k295138	Hachette (Paris)
1	http://obvil.github.io/critique2000/tei/patouillet_1912.xml	1912_patouillet_ostrovski-theatre-moeurs-russes-patouillet_GALLICA	Patouillet, Jules (18..-19.. ; professeur à l'Université de Lyon)	1912	Ostrovski et son théâtre de moeurs russes / J. Patouillet,...	http://gallica.bnf.fr/ark:/12148/bpt6k372139k	Librairie Plon, Plon-Nourrit et Cie (Paris)
1	http://obvil-dev.paris-sorbonne.fr/corpus/critique/paulhan_morale-ironie.xml	1911_paulhan_morale-ironie_OBVIL	Paulhan, Frédéric (1856-1931)	1911	La morale de l’ironie	http://obvil.paris-sorbonne.fr/corpus/critique/paulhan_morale-ironie	
1	http://obvil-dev.paris-sorbonne.fr/corpus/critique/paulhan_psychologie-invention.xml	1911_paulhan_b_psychologie-invention-ed_OBVIL	Paulhan, Frédéric (1856-1931)	1911	Psychologie de l’invention (2e éd.)	http://obvil.paris-sorbonne.fr/corpus/critique/paulhan_psychologie-invention/	
1	http://obvil.github.io/critique2000/tei/pavie_1887.xml	1887_pavie_victor-pavie-jeunesse-relations-litteraires_GALLICA	Pavie, Théodore (1811-1896)	1887	Victor Pavie / sa jeunesse, ses relations littéraires	http://gallica.bnf.fr/ark:/12148/bpt6k1131118	impr. de P. Lachèse et Dolbeau (Angers)
1	http://obvil-dev.paris-sorbonne.fr/corpus/critique/peguy_zangwill.xml	1904_peguy_zangwill_OBVIL	Péguy, Charles (1873-1914)	1904	Zangwill	https://obvil.paris-sorbonne.fr/corpus/critique/peguy_zangwill	
1	http://obvil-dev.paris-sorbonne.fr/corpus/critique/peguy_hugo.xml	1910_peguy_victor-marie-comte-hugo_OBVIL	Péguy, Charles (1873-1914)	1910	Victor-Marie, comte Hugo	http://obvil.paris-sorbonne.fr/corpus/critique/peguy_hugo	
1	http://obvil-dev.paris-sorbonne.fr/corpus/critique/peguy_note-descartes.xml	1914_peguy_note-conjointe-descartes-philosophie-cartesienne_OBVIL	Péguy, Charles (1873-1914)	1914	Note conjointe sur M. Descartes et la philosophie cartésienne	http://obvil.paris-sorbonne.fr/corpus/critique/peguy_note-descartes	
1	http://obvil-dev.paris-sorbonne.fr/corpus/critique/peguy_note-bergson.xml	1914_peguy_b_note-bergson-philosophie-bergsonienne_OBVIL	Péguy, Charles (1873-1914)	1914	Note sur M. Bergson et la philosophie bergsonienne	http://obvil.paris-sorbonne.fr/corpus/critique/peguy_note-bergson	
1	http://obvil.github.io/critique2000/tei/peignot_1817.xml	1817_peignot_recherches-ouvrages-voltaire-contenant-reflexions-generales_GALLICA	Peignot, Gabriel (1767-1849)	1817	Recherches sur les ouvrages de Voltaire , contenant : 1° des réflexions générales sur ses écrits ; 2° une notice raisonnée des différentes éditions de ses oeuvres... depuis 1732... 3° le détail des condamnations juridiques qu'ont encourues la plupart de ses écrits ; et 4° l'indication... des principaux ouvrages où l'on a combattu ses principes dangereux, par J. J. E. G... avocat...	http://gallica.bnf.fr/ark:/12148/bpt6k5485205g	les marchands de nouveautés (Paris)
1	http://obvil.github.io/critique2000/tei/peignot_1836.xml	1836_peignot_souvenirs-relatifs-bibliotheques-particulieres-temps_GALLICA	Peignot, Gabriel (1767-1849)	1836	Souvenirs relatifs à quelques bibliothèques particulières des temps passés, par Gab. Peignot	http://gallica.bnf.fr/ark:/12148/bpt6k54821961	Techener (Paris)
1	http://obvil.github.io/critique2000/tei/peladan_1886.xml	1886_peladan_decadence-latine-vice-supreme-josephin-peladan-preface_GALLICA	Peladan, Joséphin (1858-1918)	1886	La décadence latine. I, Le vice suprême / Joséphin Péladan ; préface de J. Barbey d'Aurevilly ; frontispice à l'eau-forte de Félicien Rops	http://gallica.bnf.fr/ark:/12148/bpt6k61016425	A. Laurent (Paris)
1	http://obvil.github.io/critique2000/tei/pellissier_1873.xml	1873_pellissier_precis-histoire-langue-francaise-origine-jours-edition_GALLICA	Pellissier, Augustin (1819-1894)	1873	Précis d'histoire de la langue française : depuis son origine jusqu'à nos jours (2e édition revue et augmentée de textes anciens, avec traduction et commentaire) / par A. Pellissier,...	http://gallica.bnf.fr/ark:/12148/bpt6k64958088	Didier et Cie (Paris)
1	http://obvil.github.io/critique2000/tei/pellissier_1883.xml	1883_pellissier_vie-oeuvres-bartas-these-presentee-faculte-lettres_GALLICA	Pellissier, Georges (1852-1918)	1883	La Vie et les oeuvres de Du Bartas, thèse présentée à la Faculté des lettres de Paris, par Georges Pellissier,...	http://gallica.bnf.fr/ark:/12148/bpt6k6516876f	Hachette (Paris)
1	http://obvil.github.io/critique2000/tei/pellissier_1883_b.xml	1883_pellissier_b_ecrivains-politiques-france-revolution-georges-pelissier_GALLICA	Pellissier, Georges (1852-1918)	1883	Les Ecrivains politiques en France avant la Révolution , par Georges Pélissier,...	http://gallica.bnf.fr/ark:/12148/bpt6k96142096	E. Weill et G. Maurice (Paris)
1	http://obvil.github.io/critique2000/tei/pellissier_1894.xml	1894_pellissier_traite-theorique-historique-versification-francaise_GALLICA	Pellissier, Georges (1852-1918)	1894	Traité théorique et historique de versification française (3e édition revue et corrigée) / par Georges Pellissier,...	http://gallica.bnf.fr/ark:/12148/bpt6k5833666h	Garnier frères (Paris)
1	http://obvil.github.io/critique2000/tei/pellissier_1898_1.xml	1898_pellissier_1_etudes-litterature-contemporaine-georges-pellissier_GALLICA	Pellissier, Georges (1852-1918)	1898	Études de littérature contemporaine... / Georges Pellissier	http://gallica.bnf.fr/ark:/12148/bpt6k9612303f	Perrin et Cie (Paris)
1	http://obvil.github.io/critique2000/tei/pellissier_1898_2.xml	1898_pellissier_2_etudes-litterature-contemporaine-serie-georges-pellissier_GALLICA	Pellissier, Georges (1852-1918)	1898	Études de littérature contemporaine.... Série 2 / Georges Pellissier	http://gallica.bnf.fr/ark:/12148/bpt6k9615464d	Perrin et Cie (Paris)
1	http://obvil.github.io/critique2000/tei/pellissier_1901.xml	1901_pellissier_mouvement-litteraire-contemporain-georges-pellissier_GALLICA	Pellissier, Georges (1852-1918)	1901	Le mouvement littéraire contemporain / par Georges Pellissier	http://gallica.bnf.fr/ark:/12148/bpt6k96127314	Hachette et Cie (Paris)
1	http://obvil.github.io/critique2000/tei/pellissier_1908.xml	1908_pellissier_voltaire-philosophe-georges-pellissier_GALLICA	Pellissier, Georges (1852-1918)	1908	Voltaire philosophe / Georges Pellissier	http://gallica.bnf.fr/ark:/12148/bpt6k2055624	A. Colin (Paris)
1	http://obvil.github.io/critique2000/tei/pellissier_1914.xml	1914_pellissier_shakespeare-superstition-shakespearienne_GALLICA	Pellissier, Georges (1852-1918)	1914	Shakespeare et la superstition shakespearienne	http://gallica.bnf.fr/ark:/12148/bpt6k9611906f	Hachette (Paris)
1	http://obvil.github.io/critique2000/tei/perlet_1848.xml	1848_perlet_influence-moeurs-comedie-discours-suivi-etudes-roles_GALLICA	Perlet, Adrien (1795-1850)	1848	De l'Influence des moeurs sur la comédie, discours suivi de deux études sur les rôles du Misanthrope et du Tartufe, par Adrien Perlet,...	http://gallica.bnf.fr/ark:/12148/bpt6k5821726f	Dauvin et Fontaine (Paris)
1	http://obvil.github.io/critique2000/tei/perrauddethoury_1858.xml	1858_perrauddethoury_notice-biographique-latouche-poete-litterateur-romancier_GALLICA	Perraud de Thoury, Eugène	1858	Notice biographique sur M. H. de Latouche, poète, littérateur et romancier. [Signé : E. Perraud de Thoury.]	http://gallica.bnf.fr/ark:/12148/bpt6k56147931	au bureau du “Musée biographique” (Paris)
1	http://obvil.github.io/critique2000/tei/petitdejulleville_1886.xml	1886_petitdejulleville_repertoire-theatre-comique-france-moyen-age-histoire_GALLICA	Petit de Julleville, Louis (1841-1900)	1886	Répertoire du théâtre comique en France au moyen âge : histoire du théâtre en France / par L. Petit de Julleville,...	http://gallica.bnf.fr/ark:/12148/bpt6k210027z	L. Cerf (Paris)
1	http://obvil.github.io/critique2000/tei/petitdejulleville_1892.xml	1892_petitdejulleville_theatre-france-histoire-litterature-dramatique-origines_GALLICA	Petit de Julleville, Louis (1841-1900)	1892	Le Théâtre en France, histoire de la littérature dramatique, depuis ses origines jusqu'à nos jours, par L. Petit de Julleville,...	http://gallica.bnf.fr/ark:/12148/bpt6k5569299g	A. Colin (Paris)
1	http://obvil.github.io/critique2000/tei/petitdejulleville_1895.xml	1895_petitdejulleville_idee-dieu-poesie-julleville_GALLICA	Petit de Julleville, Louis (1841-1900)	1895	L'idée de Dieu et la poésie / par L. Petit de Julleville,...	http://gallica.bnf.fr/ark:/12148/bpt6k5467489x	J. André (Paris)
1	http://obvil.github.io/critique2000/tei/petitdejulleville_1896_1.xml	1896_petitdejulleville_1_histoire-langue-litterature-francaise-origines-moyen_GALLICA	Petit de Julleville, Louis (1841-1900)	1896	Histoire de la langue et de la littérature française, des origines à 1900. Moyen âge (des origines à 1500) / publiée sous la direction de L. Petit de Julleville,...	http://gallica.bnf.fr/ark:/12148/bpt6k6152360r	A. Colin (Paris)
1	http://obvil.github.io/critique2000/tei/petitdejulleville_1896_2.xml	1896_petitdejulleville_2_histoire-langue-litterature-francaise-origines-siecle_GALLICA	Petit de Julleville, Louis (1841-1900)	1896	Histoire de la langue et de la littérature française, des origines à 1900. XVIe siècle / publiée sous la direction de L. Petit de Julleville,...	http://gallica.bnf.fr/ark:/12148/bpt6k6149099g	A. Colin (Paris)
1	http://obvil.github.io/critique2000/tei/petitdejulleville_1896_3.xml	1896_petitdejulleville_3_histoire-langue-litterature-francaise-origines-siecle_GALLICA	Petit de Julleville, Louis (1841-1900)	1896	Histoire de la langue et de la littérature française, des origines à 1900. XVIIe siècle (1re partie : 1601-1660) / publiée sous la direction de L. Petit de Julleville,...	http://gallica.bnf.fr/ark:/12148/bpt6k6149060m	A. Colin (Paris)
1	http://obvil.github.io/critique2000/tei/petitdejulleville_1896_4.xml	1896_petitdejulleville_4_histoire-langue-litterature-francaise-origines-siecle_GALLICA	Petit de Julleville, Louis (1841-1900)	1896	Histoire de la langue et de la littérature française, des origines à 1900. XVIIe siècle (2e partie : 1661-1700) / publiée sous la direction de L. Petit de Julleville,...	http://gallica.bnf.fr/ark:/12148/bpt6k6149103x	A. Colin (Paris)
1	http://obvil.github.io/critique2000/tei/petitdejulleville_1896_6.xml	1896_petitdejulleville_6_histoire-langue-litterature-francaise-origines-siecle_GALLICA	Petit de Julleville, Louis (1841-1900)	1896	Histoire de la langue et de la littérature française, des origines à 1900. XVIIIe siècle / publiée sous la direction de L. Petit de Julleville,...	http://gallica.bnf.fr/ark:/12148/bpt6k6149067h	A. Colin (Paris)
1	http://obvil.github.io/critique2000/tei/petitdejulleville_1896_7.xml	1896_petitdejulleville_7_histoire-langue-litterature-francaise-origines-siecle_GALLICA	Petit de Julleville, Louis (1841-1900)	1896	Histoire de la langue et de la littérature française, des origines à 1900. XIXe siècle. Période romantique (1800-1850) / publiée sous la direction de L. Petit de Julleville,...	http://gallica.bnf.fr/ark:/12148/bpt6k61518605	A. Colin (Paris)
1	http://obvil.github.io/critique2000/tei/petitdejulleville_1896_8.xml	1896_petitdejulleville_8_histoire-langue-litterature-francaise-origines-siecle_GALLICA	Petit de Julleville, Louis (1841-1900)	1896	Histoire de la langue et de la littérature française, des origines à 1900. XIXe siècle. Période contemporaine (1850-1900) / publiée sous la direction de L. Petit de Julleville,...	http://gallica.bnf.fr/ark:/12148/bpt6k61490611	A. Colin (Paris)
1	http://obvil.github.io/critique2000/tei/petitdejulleville_1897.xml	1897_petitdejulleville_histoire-theatre-france-comedie-moeurs-france-moyen_GALLICA	Petit de Julleville, Louis (1841-1900)	1897	Histoire du théâtre en France. La Comédie et les moeurs en France au moyen âge, par L. Petit de Julleville,...	http://gallica.bnf.fr/ark:/12148/bpt6k55676055	L. Cerf (Paris)
1	http://obvil.github.io/critique2000/tei/petitdejulleville_1896_5.xml	1896_petitdejulleville_5_histoire-langue-litterature-francaise-origines-publiee_GALLICA	Petit de Julleville, Pierre	1896	Histoire de la langue et de la littérature française, des origines à 1900 / publiée sous la direction de L. Petit de Julleville,...	http://gallica.bnf.fr/ark:/12148/bpt6k6203770p	A. Colin (Paris)
1	http://obvil.github.io/critique2000/tei/petit-radel_1892.xml	1892_petit-radel_histoire-litteraire-france-t-siecle-dom-brial-daunou_GALLICA	Petit-Radel, Louis-Charles François (1756-1836)	1892	Histoire littéraire de la France. T. XVI, XIIIe siècle / [Par dom Brial, Daunou, Amaury Duval, Ginguené, de Pastoret et Petit-Radel] ; ouvrage commencé par des religieux Bénédictins de la Congrégation de Saint-Maur et continué par des membres de l'Institut...	http://gallica.bnf.fr/ark:/12148/bpt6k6338134c	V. Palmé (Paris)
1	http://obvil.github.io/critique2000/tei/philibert-soupe_1856.xml	1856_philibert-soupe_essai-critique-litterature-indienne-etudes-sanscrites_GALLICA	Philibert-Soupé, Alfred (1818-1904)	1856	Essai critique sur la littérature indienne et les études sanscrites : avec des notes bibliographiques / par A. Philibert-Soupé,...	http://gallica.bnf.fr/ark:/12148/bpt6k5812618k	chez Ch. Vellot, libraire (Grenoble)
1	http://obvil.github.io/critique2000/tei/philibert-soupe_1858.xml	1858_philibert-soupe_tableau-litterature-dramatique-europe-origine-jours_GALLICA	Philibert-Soupé, Alfred (1818-1904)	1858	Tableau de la littérature dramatique en Europe : depuis l'origine jusqu'à nos jours / par A. Philibert-Soupé,...	http://gallica.bnf.fr/ark:/12148/bpt6k433117n	impr. de Maisonville (Grenoble)
1	http://obvil.github.io/critique2000/tei/picot_1878.xml	1878_picot_sottie-france-fragment-repertoire-historique-bibliographique_GALLICA	Picot, Émile (1844-1918)	1878	La sottie en France : fragment d'un répertoire historique et bibliographique de l'ancien théâtre français / par Émile Picot	http://gallica.bnf.fr/ark:/12148/bpt6k55291123	impr. de Daupeley-Gouverneur (Nogent-le-Rotrou)
1	http://obvil-dev.paris-sorbonne.fr/corpus/critique/pierre-quint_droits-ecrivains.xml	1928_pierre-quint_droits-ecrivain-societe-contemporaine_OBVIL	Pierre-Quint, Léon (1895-1958)	1928	Les droits de l’écrivain dans la société contemporaine	http://obvil.paris-sorbonne.fr/corpus/critique/pierre-quint_droits-ecrivains/	
1	http://obvil.github.io/critique2000/tei/pifteau_1879_1.xml	1879_pifteau_1_histoire-theatre-france-origines-cid-t-benjamin-pifteau_GALLICA	Pifteau, Benjamin (1836-1890)	1879	Histoire du théâtre en France, des origines au Cid (1398-1636). T. 1 / par Benjamin Pifteau et Julien Goujon,...	http://gallica.bnf.fr/ark:/12148/bpt6k2043640	L. Willem (Paris)
1	http://obvil.github.io/critique2000/tei/pifteau_1879_2.xml	1879_pifteau_2_histoire-theatre-france-origines-cid-t-benjamin-pifteau_GALLICA	Pifteau, Benjamin (1836-1890)	1879	Histoire du théâtre en France, des origines au Cid (1398-1636). T. 2 / par Benjamin Pifteau et Julien Goujon,...	http://gallica.bnf.fr/ark:/12148/bpt6k204365c	L. Willem (Paris)
1	http://obvil.github.io/critique2000/tei/pigault-lebrun_1803.xml	1803_pigault-lebrun_monsieur-botte-tome-pigault-lebrun_GALLICA	Pigault-Lebrun (1753-1835)	1803	Monsieur Botte. Tome 4 / , par Pigault-Lebrun	http://gallica.bnf.fr/ark:/12148/bpt6k6461563c	Barba (Paris)
1	http://obvil.github.io/critique2000/tei/planche_1854.xml	1854_planche_nouveaux-portraits-litteraires-gustave-planche_GALLICA	Planche, Gustave (1808-1857)	1854	Nouveaux portraits littéraires... / Gustave Planche	http://gallica.bnf.fr/ark:/12148/bpt6k9611408j	Amyot (Paris)
1	http://obvil.github.io/critique2000/tei/poinsinet_1755.xml	1755_poinsinet_lettre-homme-vieux-tems-orphelin-chine-tragedie-voltaire_GALLICA	Poinsinet, Antoine-Alexandre-Henri (1735-1769)	1755	Lettre à un homme du vieux tems sur L'orphelin de la Chine , tragédie de M. de Voltaire, représentée pour la première fois le 20 août 1755	http://gallica.bnf.fr/ark:/12148/bpt6k5713232j	[S. l., après 1755]
1	http://obvil.github.io/critique2000/tei/ponsard_1867.xml	1867_ponsard_galilee-ponsard-polyeucte-astronomie_GALLICA	Ponsard, François	1867	Le Galilée de M. Ponsard ou le Polyeucte de l'astronomie	http://gallica.bnf.fr/ark:/12148/bpt6k5788743j	
